{
  "schemaVersion": 1,
  "id": "vanilla-melee-starter",
  "title": "Vanilla Melee Starter Path",
  "author": "TerraPath Team",
  "language": "en-US",
  "summary": "A tiny example guide that demonstrates TerraPath progression stages, boss references, and categorized item picks.",
  "requiredMods": ["Terraria"],
  "classTags": ["melee"],
  "guideTags": ["starter", "example", "vanilla"],
  "createdAt": "2026-04-09",
  "updatedAt": "2026-04-09",
  "stages": [
    {
      "id": "first-night",
      "title": "First Night",
      "era": "prehardmode",
      "description": "Collect basic mobility, find surface chests, and prepare a safe arena before fighting early bosses.",
      "subStages": [
        {
          "title": "Before Eye of Cthulhu",
          "description": "Focus on movement, a simple arena, and one reliable early melee option."
        }
      ],
      "bossRefs": [],
      "items": [
        {
          "itemId": "Terraria/EnchantedBoomerang",
          "category": "weapon"
        },
        {
          "itemId": "Terraria/CloudinaBottle",
          "category": "accessory",
          "subgroup": "Mobility"
        },
        {
          "itemId": "Terraria/HermesBoots",
          "category": "accessory",
          "subgroup": "Mobility"
        }
      ]
    }
  ]
}
